{
  "$schema": "https://json-schema.org/draft/2020-12/schema",
  "$id": "https://raw.githubusercontent.com/AbdelStark/grover-tax/main/docs/spec/schemas/fixture-v0.1.schema.json",
  "title": "grover-tax fixture v0.1",
  "description": "Schema for fixtures/v0.1.json — the canonical input shared by both provers. See docs/spec/03-data-model.md §'Fixture' for the F-INV-1..9 invariants.",
  "type": "object",
  "additionalProperties": false,
  "required": [
    "version",
    "generator_commit",
    "workload_pin_commit",
    "seed_hex",
    "n_samples",
    "bit_stripe_width",
    "circuit_serialisation_format_version",
    "circuit_byte_serialisation_hex",
    "circuit_commitment_sha256_hex",
    "circuit_commitment_blake2s_hex",
    "test_cases"
  ],
  "properties": {
    "version": {
      "description": "Fixture-format version. Frozen at 'v0.1' for the entire v0.1.x series (F-INV-7).",
      "const": "v0.1"
    },
    "generator_commit": {
      "description": "Repo SHA at the time gen_fixtures.py produced this file. Excluded from --check normalisation.",
      "type": "string",
      "pattern": "^[0-9a-f]{40}$"
    },
    "workload_pin_commit": {
      "description": "Upstream zkp_ecc SHA recorded in WORKLOAD.md frontmatter at generation time.",
      "type": "string",
      "pattern": "^[0-9a-f]{40}$"
    },
    "seed_hex": {
      "description": "sha256(SEED) — 32 bytes, lowercase hex, length 64 (F-INV-8).",
      "type": "string",
      "pattern": "^[0-9a-f]{64}$"
    },
    "n_samples": {
      "description": "Number of test cases. Must equal len(test_cases) (F-INV-1).",
      "type": "integer",
      "minimum": 1
    },
    "bit_stripe_width": {
      "description": "Reversible-circuit bit-stripe width W from WORKLOAD.md.",
      "type": "integer",
      "minimum": 1
    },
    "circuit_serialisation_format_version": {
      "description": "Canonical serialisation format version (F-INV-6). v0.1 freezes this at 1.",
      "const": 1
    },
    "circuit_byte_serialisation_hex": {
      "description": "Canonical byte serialisation of gate-list C, lowercase hex, even length (F-INV-8).",
      "type": "string",
      "pattern": "^([0-9a-f]{2})+$"
    },
    "circuit_commitment_sha256_hex": {
      "description": "sha256(bytes.fromhex(circuit_byte_serialisation_hex)). Verified by F-INV-2.",
      "type": "string",
      "pattern": "^[0-9a-f]{64}$"
    },
    "circuit_commitment_blake2s_hex": {
      "description": "blake2s(bytes.fromhex(circuit_byte_serialisation_hex)) — 32-byte digest, no personalisation. Verified by F-INV-3.",
      "type": "string",
      "pattern": "^[0-9a-f]{64}$"
    },
    "test_cases": {
      "description": "Ordered list of (P,Q,R) tuples; iteration order is binding (F-INV-9).",
      "type": "array",
      "minItems": 1,
      "items": { "$ref": "#/$defs/TestCase" }
    }
  },
  "$defs": {
    "TestCase": {
      "type": "object",
      "additionalProperties": false,
      "required": ["x_hex", "y_hex"],
      "properties": {
        "x_hex": {
          "description": "Encoded secp256k1 inputs (a pair of points) per docs/spec/03-data-model.md §'Fixture'. Length is fixed at 128 lowercase-hex characters by the table in the data-model spec.",
          "type": "string",
          "pattern": "^[0-9a-f]{128}$"
        },
        "y_hex": {
          "description": "Encoded secp256k1 output (one compressed-affine point) per docs/spec/03-data-model.md §'Fixture'. Length is fixed at 66 lowercase-hex characters.",
          "type": "string",
          "pattern": "^[0-9a-f]{66}$"
        }
      }
    }
  }
}
