{
  "version": "v0.1",
  "generator_commit": "0123456789abcdef0123456789abcdef01234567",
  "workload_pin_commit": "abcdef0123456789abcdef0123456789abcdef01",
  "seed_hex": "0123456789abcdef0123456789abcdef0123456789abcdef0123456789abcdef",
  "n_samples": 2,
  "bit_stripe_width": 64,
  "circuit_serialisation_format_version": 1,
  "circuit_byte_serialisation_hex": "4754563101000000000000000000ffff",
  "circuit_commitment_sha256_hex": "1111111111111111111111111111111111111111111111111111111111111111",
  "circuit_commitment_blake2s_hex": "2222222222222222222222222222222222222222222222222222222222222222",
  "test_cases": [
    {
      "x_hex": "aabbccddeeff00112233445566778899aabbccddeeff00112233445566778899aabbccddeeff00112233445566778899aabbccddeeff00112233445566778899",
      "y_hex": "02aabbccddeeff00112233445566778899aabbccddeeff00112233445566778899"
    },
    {
      "x_hex": "bbccddeeff00112233445566778899aabbccddeeff00112233445566778899aabbccddeeff00112233445566778899aabbccddeeff00112233445566778899aa",
      "y_hex": "03aabbccddeeff00112233445566778899aabbccddeeff00112233445566778899"
    }
  ]
}
